{
  "$schema": "../schemas/task-status.schema.json",
  "task_id": "PG-135",
  "section": "Core CRM",
  "description": "Deal Pipeline Page - Kanban board drag-drop stages value totals filtering",
  "owner": "Frontend Dev (STOA-Domain)",
  "sprint": "sprint-6",
  "status": "DONE",
  "started_at": "2026-03-08T21:44:04.232Z",
  "completed_at": "2026-03-08T21:59:04.232Z",
  "dependencies": {
    "required": [
      "IFC-186"
    ],
    "all_satisfied": true,
    "verified_at": "2026-04-20T22:01:19.398Z"
  },
  "artifacts": {
    "expected": [],
    "missing": []
  },
  "validations": [
    {
      "name": "completion-evidence",
      "command": "# Task marked Completed in Sprint_plan.csv",
      "executed_at": "2026-03-08T00:00:00Z",
      "exit_code": 0,
      "passed": true
    }
  ],
  "notes": "Evidence stub. Task marked Completed in Sprint_plan.csv. Full evidence may be recorded in sprint attestations or audit reports.",
  "actual_duration_minutes": 15,
  "dependencies_resolved": [
    "IFC-186"
  ]
}
