{
  "$schema": "../schemas/task-status.schema.json",
  "task_id": "PG-024",
  "section": "Auth Pages",
  "description": "SSO Callback",
  "owner": "Platform FE (STOA-Foundation)",
  "sprint": "sprint-13",
  "status": "DONE",
  "started_at": "2026-03-08T21:44:04.679Z",
  "completed_at": "2026-03-08T21:59:04.679Z",
  "dependencies": {
    "required": ["PG-015", "IFC-006"],
    "all_satisfied": true,
    "verified_at": "2026-04-19T10:06:57.075Z"
  },
  "artifacts": {
    "expected": [],
    "missing": []
  },
  "validations": [
    {
      "name": "completion-evidence",
      "command": "# Task marked Completed in Sprint_plan.csv",
      "executed_at": "2026-03-08T00:00:00Z",
      "exit_code": 0,
      "passed": true
    }
  ],
  "notes": "Evidence stub. Task marked Completed in Sprint_plan.csv. Full evidence may be recorded in sprint attestations or audit reports.",
  "actual_duration_minutes": 15,
  "dependencies_resolved": ["PG-015", "IFC-006"]
}
