{
  "$schema": "../schemas/task-status.schema.json",
  "task_id": "IFC-022",
  "section": "Intelligence",
  "description": "PHASE-011: Structured AI Output Implementation",
  "owner": "AI Specialist + Backend Dev (STOA-Intelligence)",
  "sprint": "sprint-6",
  "status": "DONE",
  "started_at": "2026-03-08T21:44:04.187Z",
  "completed_at": "2026-03-08T21:59:04.187Z",
  "dependencies": {
    "required": [
      "IFC-021"
    ],
    "all_satisfied": true,
    "verified_at": "2026-04-22T21:20:05.550Z"
  },
  "artifacts": {
    "expected": [],
    "missing": []
  },
  "validations": [
    {
      "name": "completion-evidence",
      "command": "# Task marked Completed in Sprint_plan.csv",
      "executed_at": "2026-03-08T00:00:00Z",
      "exit_code": 0,
      "passed": true
    }
  ],
  "notes": "Evidence stub. Task marked Completed in Sprint_plan.csv. Full evidence may be recorded in sprint attestations or audit reports.",
  "actual_duration_minutes": 15,
  "dependencies_resolved": [
    "IFC-021"
  ]
}
