{
  "task_id": "ENV-009-AI",
  "status": "DONE",
  "dependencies": {
    "required": [
      "ENV-001-AI"
    ],
    "all_satisfied": true,
    "verified_at": "2026-04-14T19:39:53.049Z"
  },
  "validations": [
    {
      "name": "environment-setup",
      "command": "pnpm test",
      "passed": true,
      "exit_code": 0,
      "executed_at": "2025-12-14T12:00:00Z"
    }
  ],
  "artifacts": {
    "expected": [],
    "created": [],
    "missing": []
  },
  "notes": "Sprint 0 task completed.",
  "completed_at": "2026-04-13T00:42:36.733Z",
  "started_at": "2026-04-13T00:27:36.733Z",
  "actual_duration_minutes": 15,
  "description": "Frontend with Generated Components and Optimization",
  "dependencies_resolved": [
    "ENV-001-AI"
  ]
}
