{
  "$schema": "../schemas/task-status.schema.json",
  "task_id": "IFC-013",
  "section": "MVP Week 1",
  "description": "PHASE-002: tRPC Router Implementation",
  "owner": "Backend Dev + Tech Lead (STOA-Domain)",
  "sprint": "sprint-6",
  "status": "DONE",
  "started_at": "2026-03-08T21:44:04.175Z",
  "completed_at": "2026-03-08T21:59:04.175Z",
  "dependencies": {
    "required": [
      "IFC-012"
    ],
    "all_satisfied": true,
    "verified_at": "2026-04-24T20:51:58.885Z"
  },
  "artifacts": {
    "expected": [],
    "missing": []
  },
  "validations": [
    {
      "name": "completion-evidence",
      "command": "# Task marked Completed in Sprint_plan.csv",
      "executed_at": "2026-03-08T00:00:00Z",
      "exit_code": 0,
      "passed": true
    }
  ],
  "notes": "Evidence stub. Task marked Completed in Sprint_plan.csv. Full evidence may be recorded in sprint attestations or audit reports.",
  "actual_duration_minutes": 15,
  "dependencies_resolved": [
    "IFC-012"
  ]
}
