{
  "$schema": "../schemas/task-status.schema.json",
  "task_id": "IFC-176",
  "section": "AI Foundation",
  "description": "AI Output Review - Validators Layer (Zod schemas for review inputs/outputs)",
  "owner": "Backend Dev (STOA-Quality)",
  "sprint": "sprint-3",
  "status": "DONE",
  "started_at": "2026-03-08T21:44:04.145Z",
  "completed_at": "2026-03-08T21:59:04.145Z",
  "dependencies": {
    "required": [
      "IFC-128"
    ],
    "all_satisfied": true,
    "verified_at": "2026-04-13T01:23:27.537Z"
  },
  "artifacts": {
    "expected": [],
    "missing": []
  },
  "validations": [
    {
      "name": "completion-evidence",
      "command": "# Task marked Completed in Sprint_plan.csv",
      "executed_at": "2026-03-08T00:00:00Z",
      "exit_code": 0,
      "passed": true
    }
  ],
  "notes": "Evidence stub. Task marked Completed in Sprint_plan.csv. Full evidence may be recorded in sprint attestations or audit reports.",
  "actual_duration_minutes": 15,
  "dependencies_resolved": [
    "IFC-128"
  ]
}
