{
  "$schema": "../schemas/task-status.schema.json",
  "task_id": "IFC-152",
  "section": "Case Docs",
  "description": "Case document model: storage metadata, versioning, ACL mapping (tenant + case + role), and audit hooks",
  "owner": "Backend Dev + Domain Architect (STOA-Intelligence)",
  "sprint": "sprint-6",
  "status": "DONE",
  "started_at": "2026-03-08T21:44:04.223Z",
  "completed_at": "2026-03-08T21:59:04.223Z",
  "dependencies": {
    "required": [
      "IFC-136",
      "IFC-127"
    ],
    "all_satisfied": true,
    "verified_at": "2026-04-26T09:27:20.958Z"
  },
  "artifacts": {
    "expected": [],
    "missing": []
  },
  "validations": [
    {
      "name": "completion-evidence",
      "command": "# Task marked Completed in Sprint_plan.csv",
      "executed_at": "2026-03-08T00:00:00Z",
      "exit_code": 0,
      "passed": true
    }
  ],
  "notes": "Evidence stub. Task marked Completed in Sprint_plan.csv. Full evidence may be recorded in sprint attestations or audit reports.",
  "actual_duration_minutes": 15,
  "dependencies_resolved": [
    "IFC-136",
    "IFC-127"
  ]
}
