{
  "$schema": "../schemas/task-status.schema.json",
  "task_id": "IFC-058",
  "section": "Compliance",
  "description": "GDPR baseline controls: Supabase RLS policies, data minimisation, retention hooks",
  "owner": "DPO + Legal (STOA-Foundation)",
  "sprint": "sprint-11",
  "status": "DONE",
  "started_at": "2026-03-08T21:44:04.610Z",
  "completed_at": "2026-03-08T21:59:04.610Z",
  "dependencies": {
    "required": [
      "IFC-017",
      "IFC-127",
      "IFC-008"
    ],
    "all_satisfied": true,
    "verified_at": "2026-04-13T22:40:47.240Z"
  },
  "artifacts": {
    "expected": [],
    "missing": []
  },
  "validations": [
    {
      "name": "completion-evidence",
      "command": "# Task marked Completed in Sprint_plan.csv",
      "executed_at": "2026-03-08T00:00:00Z",
      "exit_code": 0,
      "passed": true
    }
  ],
  "notes": "Evidence stub. Task marked Completed in Sprint_plan.csv. Full evidence may be recorded in sprint attestations or audit reports.",
  "actual_duration_minutes": 15,
  "dependencies_resolved": [
    "IFC-017",
    "IFC-127",
    "IFC-008"
  ]
}
