{
  "task_id": "IFC-025",
  "section": "Intelligence",
  "description": "PHASE-011: A/B Testing Framework",
  "owner": "Data Scientist + Backend Dev (STOA-Intelligence)",
  "status": "Completed",
  "started_at": "2026-01-03T00:00:00Z",
  "completed_at": "2026-01-03T00:00:00Z",
  "actual_duration_minutes": 240,
  "status_history": [
    {
      "status": "Backlog",
      "at": "2026-01-01T00:00:00Z",
      "note": "initial backlog"
    },
    {
      "status": "In Progress",
      "at": "2026-01-03T00:00:00Z",
      "note": "implementation started"
    },
    {
      "status": "Completed",
      "at": "2026-01-03T00:00:00Z",
      "note": "implementation complete, attestation created"
    },
    {
      "status": "Completed",
      "at": "2026-02-22T20:26:00Z",
      "note": "revalidation: proper attestation with real evidence replacing batch-repair stub"
    }
  ],
  "dependencies": {
    "required": ["IFC-022"],
    "all_satisfied": true,
    "verified_at": "2026-01-03T00:00:00Z"
  },
  "execution": {
    "started_at": "2026-01-03T00:00:00Z",
    "completed_at": "2026-01-03T00:00:00Z",
    "duration_minutes": 240,
    "executor": "Claude Opus 4.5",
    "agents": ["STOA-Intelligence"],
    "retry_count": 0
  },
  "artifacts": {
    "expected": [
      "packages/validators/src/experiment.ts",
      "apps/ai-worker/src/analytics/statistical-analysis.ts",
      "packages/application/src/services/ExperimentService.ts",
      "apps/api/src/modules/experiment/experiment.router.ts",
      "packages/ui/src/components/experiment/ExperimentDashboard.tsx",
      "infra/monitoring/ab-test-config.json",
      "artifacts/reports/statistical-analysis-report.json"
    ],
    "created": [
      {
        "path": "packages/validators/src/experiment.ts",
        "sha256": "db374220fcf8d376b9e76351658e84ba4d1327dcaa56f619a253c78bc3fb1e91",
        "created_at": "2026-01-03T00:00:00Z"
      },
      {
        "path": "apps/ai-worker/src/analytics/statistical-analysis.ts",
        "sha256": "6d99321546090a3e43d2a3b71d9357886ffcdcf96e96ed2d735dddb9bb7f1491",
        "created_at": "2026-01-03T00:00:00Z"
      },
      {
        "path": "packages/application/src/services/ExperimentService.ts",
        "sha256": "708dd07feed7d043669adb5ed968e0dfcf939d97dbcdc149628504dfc92a82a7",
        "created_at": "2026-01-03T00:00:00Z"
      },
      {
        "path": "apps/api/src/modules/experiment/experiment.router.ts",
        "sha256": "52a49af814e757c63084da8c1048615cdac765f58a89132b2203c9df42fc3a94",
        "created_at": "2026-01-03T00:00:00Z"
      },
      {
        "path": "packages/ui/src/components/experiment/ExperimentDashboard.tsx",
        "sha256": "96bbe37fb34439a7e2e75be544cfccedf12ff2cf9278cd595e2aa72e8523da88",
        "created_at": "2026-01-03T00:00:00Z"
      },
      {
        "path": "infra/monitoring/ab-test-config.json",
        "sha256": "1b1d158efcbc464f44b43dcca8919dc466e0d82c1e95e44ec84b10585a3fc67e",
        "created_at": "2026-01-03T00:00:00Z"
      },
      {
        "path": "artifacts/reports/statistical-analysis-report.json",
        "sha256": "983ed3e00ad909a9875eb5f3505b4364a7ec9b904e88a1948db9953242146399",
        "created_at": "2026-01-03T00:00:00Z"
      }
    ],
    "missing": []
  },
  "validations": [
    {
      "name": "TypeScript",
      "command": "pnpm typecheck",
      "executed_at": "2026-02-22T20:21:22Z",
      "exit_code": 0,
      "duration_ms": 8282,
      "stdout_hash": "33-tasks-successful-32-cached",
      "passed": true
    },
    {
      "name": "Tests",
      "command": "npx vitest run packages/validators/__tests__/experiment.test.ts apps/ai-worker/src/analytics/__tests__/statistical-analysis.test.ts apps/api/src/modules/experiment/__tests__/experiment.router.test.ts",
      "executed_at": "2026-02-22T20:21:22Z",
      "exit_code": 0,
      "duration_ms": 558,
      "stdout_hash": "113-tests-passed-3-files",
      "passed": true
    },
    {
      "name": "Lint",
      "command": "pnpm --filter @intelliflow/validators lint && pnpm --filter @intelliflow/ai-worker lint && pnpm --filter @intelliflow/api lint && pnpm --filter @intelliflow/ui lint",
      "executed_at": "2026-02-22T20:21:22Z",
      "exit_code": 0,
      "duration_ms": 12000,
      "stdout_hash": "4-packages-clean",
      "passed": true
    },
    {
      "name": "Build",
      "command": "pnpm build",
      "executed_at": "2026-02-22T20:22:30Z",
      "exit_code": 0,
      "duration_ms": 67686,
      "stdout_hash": "20-tasks-successful-18-cached",
      "passed": true
    }
  ],
  "kpis": {
    "ai_vs_manual_comparison": {
      "target": "Variant assignment and score comparison functionality",
      "actual": "ExperimentService with deterministic variant assignment, score recording, and Welch t-test comparison",
      "met": true
    },
    "statistical_analysis": {
      "target": "Significance testing with p < 0.05 threshold",
      "actual": "Welch t-test, chi-square, Cohen d, power analysis — branch coverage 81-93%",
      "met": true
    },
    "artifacts_generated": {
      "target": "ab-test-config.json, statistical-analysis report",
      "actual": "infra/monitoring/ab-test-config.json + artifacts/reports/statistical-analysis-report.json verified with SHA256",
      "met": true
    }
  },
  "notes": "Original implementation by Claude Opus 4.5 on 2026-01-03. Revalidated 2026-02-22 with proper attestation replacing batch-repair stub. 113 tests across 3 files (48 validators, 40 statistical, 25 router). Coverage: experiment.ts 93.1% branch, statistical-analysis.ts 81.57% branch, experiment.router.ts 100% all."
}
