{
  "$schema": "../schemas/task-status.schema.json",
  "task_id": "PG-152",
  "section": "AI Intelligence",
  "description": "Agent Logs Viewer at /agent-approvals/logs - Conversation transcripts tool call records searchable log timeline",
  "owner": "Frontend Dev (STOA-Intelligence)",
  "sprint": "sprint-8",
  "status": "DONE",
  "started_at": "2026-03-08T21:44:04.589Z",
  "completed_at": "2026-03-08T21:59:04.589Z",
  "dependencies": {
    "required": [
      "IFC-148",
      "IFC-197"
    ],
    "all_satisfied": true,
    "verified_at": "2026-03-16T18:39:37.401Z"
  },
  "artifacts": {
    "expected": [],
    "missing": []
  },
  "validations": [
    {
      "name": "completion-evidence",
      "command": "# Task marked Completed in Sprint_plan.csv",
      "executed_at": "2026-03-08T00:00:00Z",
      "exit_code": 0,
      "passed": true
    }
  ],
  "notes": "Evidence stub. Task marked Completed in Sprint_plan.csv. Full evidence may be recorded in sprint attestations or audit reports.",
  "actual_duration_minutes": 15,
  "dependencies_resolved": [
    "IFC-148",
    "IFC-197"
  ]
}
